[
  {
    "name": "Writing and content",
    "slug": "writing-and-content",
    "parent": null,
    "level": 1,
    "description": "Drafting, editing, and producing written material.",
    "aliases": [],
    "children": [
      "long-form-writing",
      "copywriting",
      "grammar-and-style-checking",
      "paraphrasing-and-rewriting",
      "summarisation",
      "translation-and-localisation",
      "scriptwriting",
      "academic-and-technical-writing",
      "ai-content-detection"
    ],
    "last_reviewed": "2026-08-21"
  },
  {
    "name": "Long-form writing",
    "slug": "long-form-writing",
    "parent": "writing-and-content",
    "level": 2,
    "description": "Drafting articles, reports, books, and other extended pieces.",
    "aliases": [
      "article writing"
    ],
    "children": [],
    "last_reviewed": "2026-08-21"
  },
  {
    "name": "Copywriting",
    "slug": "copywriting",
    "parent": "writing-and-content",
    "level": 2,
    "description": "Short persuasive text for ads, landing pages, product pages, and email.",
    "aliases": [],
    "children": [],
    "last_reviewed": "2026-08-21"
  },
  {
    "name": "Grammar and style checking",
    "slug": "grammar-and-style-checking",
    "parent": "writing-and-content",
    "level": 2,
    "description": "Correcting mechanics and enforcing a consistent house style.",
    "aliases": [
      "proofreading"
    ],
    "children": [],
    "last_reviewed": "2026-08-21"
  },
  {
    "name": "Paraphrasing and rewriting",
    "slug": "paraphrasing-and-rewriting",
    "parent": "writing-and-content",
    "level": 2,
    "description": "Restating existing text at a different length, register, or reading level.",
    "aliases": [
      "rewriter"
    ],
    "children": [],
    "last_reviewed": "2026-08-21"
  },
  {
    "name": "Summarisation",
    "slug": "summarisation",
    "parent": "writing-and-content",
    "level": 2,
    "description": "Condensing documents, transcripts, or threads into their substance.",
    "aliases": [
      "summarization",
      "summarizer"
    ],
    "children": [],
    "last_reviewed": "2026-08-21"
  },
  {
    "name": "Translation and localisation",
    "slug": "translation-and-localisation",
    "parent": "writing-and-content",
    "level": 2,
    "description": "Moving text between languages and adapting it for a local audience.",
    "aliases": [
      "localization",
      "machine translation"
    ],
    "children": [],
    "last_reviewed": "2026-08-21"
  },
  {
    "name": "Scriptwriting",
    "slug": "scriptwriting",
    "parent": "writing-and-content",
    "level": 2,
    "description": "Writing for video, podcast, and spoken delivery.",
    "aliases": [
      "screenwriting"
    ],
    "children": [],
    "last_reviewed": "2026-08-21"
  },
  {
    "name": "Academic and technical writing",
    "slug": "academic-and-technical-writing",
    "parent": "writing-and-content",
    "level": 2,
    "description": "Papers, documentation, and other writing with citation or precision demands.",
    "aliases": [],
    "children": [],
    "last_reviewed": "2026-08-21"
  },
  {
    "name": "AI content detection",
    "slug": "ai-content-detection",
    "parent": "writing-and-content",
    "level": 2,
    "description": "Estimating whether a passage was machine written.",
    "aliases": [
      "ai detector"
    ],
    "children": [],
    "last_reviewed": "2026-08-21"
  },
  {
    "name": "Image generation and editing",
    "slug": "image-generation-and-editing",
    "parent": null,
    "level": 1,
    "description": "Creating and altering still images.",
    "aliases": [],
    "children": [
      "text-to-image",
      "image-editing",
      "background-removal",
      "upscaling-and-restoration",
      "product-photography",
      "headshots-and-avatars",
      "logo-and-brand-assets",
      "image-apis"
    ],
    "last_reviewed": "2026-08-21"
  },
  {
    "name": "Text to image",
    "slug": "text-to-image",
    "parent": "image-generation-and-editing",
    "level": 2,
    "description": "Generating an image from a written description.",
    "aliases": [
      "ai art generator"
    ],
    "children": [],
    "last_reviewed": "2026-08-21"
  },
  {
    "name": "Image editing",
    "slug": "image-editing",
    "parent": "image-generation-and-editing",
    "level": 2,
    "description": "Altering an existing image, including inpainting and object removal.",
    "aliases": [],
    "children": [],
    "last_reviewed": "2026-08-21"
  },
  {
    "name": "Background removal",
    "slug": "background-removal",
    "parent": "image-generation-and-editing",
    "level": 2,
    "description": "Separating a subject from its background.",
    "aliases": [
      "cutout"
    ],
    "children": [],
    "last_reviewed": "2026-08-21"
  },
  {
    "name": "Upscaling and restoration",
    "slug": "upscaling-and-restoration",
    "parent": "image-generation-and-editing",
    "level": 2,
    "description": "Raising resolution and repairing damaged or low-quality images.",
    "aliases": [
      "super resolution"
    ],
    "children": [],
    "last_reviewed": "2026-08-21"
  },
  {
    "name": "Product photography",
    "slug": "product-photography",
    "parent": "image-generation-and-editing",
    "level": 2,
    "description": "Producing or improving catalogue and ecommerce imagery.",
    "aliases": [],
    "children": [],
    "last_reviewed": "2026-08-21"
  },
  {
    "name": "Headshots and avatars",
    "slug": "headshots-and-avatars",
    "parent": "image-generation-and-editing",
    "level": 2,
    "description": "Generating portraits of a person from supplied photographs.",
    "aliases": [],
    "children": [],
    "last_reviewed": "2026-08-21"
  },
  {
    "name": "Logo and brand assets",
    "slug": "logo-and-brand-assets",
    "parent": "image-generation-and-editing",
    "level": 2,
    "description": "Marks, icons, and vector assets for an identity.",
    "aliases": [],
    "children": [],
    "last_reviewed": "2026-08-21"
  },
  {
    "name": "Image APIs",
    "slug": "image-apis",
    "parent": "image-generation-and-editing",
    "level": 2,
    "description": "Programmatic access to generation and editing models.",
    "aliases": [],
    "children": [],
    "last_reviewed": "2026-08-21"
  },
  {
    "name": "Video",
    "slug": "video",
    "parent": null,
    "level": 1,
    "description": "Producing, editing, and repurposing moving pictures.",
    "aliases": [],
    "children": [
      "text-to-video",
      "video-editing",
      "ai-avatars-and-presenters",
      "dubbing-and-subtitling",
      "clipping-and-repurposing",
      "animation-and-motion",
      "video-enhancement",
      "video-apis"
    ],
    "last_reviewed": "2026-08-21"
  },
  {
    "name": "Text to video",
    "slug": "text-to-video",
    "parent": "video",
    "level": 2,
    "description": "Generating footage from a written description.",
    "aliases": [],
    "children": [],
    "last_reviewed": "2026-08-21"
  },
  {
    "name": "Video editing",
    "slug": "video-editing",
    "parent": "video",
    "level": 2,
    "description": "Cutting, assembling, and correcting existing footage.",
    "aliases": [],
    "children": [],
    "last_reviewed": "2026-08-21"
  },
  {
    "name": "AI avatars and presenters",
    "slug": "ai-avatars-and-presenters",
    "parent": "video",
    "level": 2,
    "description": "Synthetic on-camera presenters delivering a script.",
    "aliases": [
      "talking head"
    ],
    "children": [],
    "last_reviewed": "2026-08-21"
  },
  {
    "name": "Dubbing and subtitling",
    "slug": "dubbing-and-subtitling",
    "parent": "video",
    "level": 2,
    "description": "Translating spoken audio and matching it to the picture.",
    "aliases": [
      "lip sync",
      "captions"
    ],
    "children": [],
    "last_reviewed": "2026-08-21"
  },
  {
    "name": "Clipping and repurposing",
    "slug": "clipping-and-repurposing",
    "parent": "video",
    "level": 2,
    "description": "Cutting long footage into short vertical pieces.",
    "aliases": [
      "shorts"
    ],
    "children": [],
    "last_reviewed": "2026-08-21"
  },
  {
    "name": "Animation and motion",
    "slug": "animation-and-motion",
    "parent": "video",
    "level": 2,
    "description": "Animating stills, characters, and motion graphics.",
    "aliases": [
      "motion capture"
    ],
    "children": [],
    "last_reviewed": "2026-08-21"
  },
  {
    "name": "Video enhancement",
    "slug": "video-enhancement",
    "parent": "video",
    "level": 2,
    "description": "Upscaling, stabilising, denoising, and interpolating footage.",
    "aliases": [],
    "children": [],
    "last_reviewed": "2026-08-21"
  },
  {
    "name": "Video APIs",
    "slug": "video-apis",
    "parent": "video",
    "level": 2,
    "description": "Programmatic access to video generation and processing.",
    "aliases": [],
    "children": [],
    "last_reviewed": "2026-08-21"
  },
  {
    "name": "Audio, music, and voice",
    "slug": "audio-music-and-voice",
    "parent": null,
    "level": 1,
    "description": "Speech, sound, music, and everything else heard rather than read.",
    "aliases": [],
    "children": [
      "text-to-speech",
      "speech-to-text",
      "voice-cloning",
      "music-generation",
      "audio-enhancement",
      "audio-editing-and-mastering",
      "podcast-production",
      "voice-agents",
      "speech-apis"
    ],
    "last_reviewed": "2026-08-21"
  },
  {
    "name": "Text to speech",
    "slug": "text-to-speech",
    "parent": "audio-music-and-voice",
    "level": 2,
    "description": "Turning written text into spoken audio.",
    "aliases": [
      "tts",
      "voice generation"
    ],
    "children": [],
    "last_reviewed": "2026-08-21"
  },
  {
    "name": "Speech to text",
    "slug": "speech-to-text",
    "parent": "audio-music-and-voice",
    "level": 2,
    "description": "Turning spoken audio into written text.",